[
  {
    "id": "ministro-alpha",
    "name": "Ministro Alpha",
    "role": "Ministro do STF",
    "position": "Presidente",
    "appointedBy": "Presidente Primário",
    "appointedAt": "2015-03-03",
    "birthYear": 1958,
    "birthState": "Paraná",
    "education": "Universidade Pública E",
    "photoUrl": "https://placehold.co/300x400/1a3a5c/ffffff?text=Alpha",
    "bio": "Ministro Alpha é natural de Roncador (PR). Foi professor de Direito Constitucional e Direito Civil na Univ E por mais de duas décadas antes de ser indicado ao STF. É conhecido por sua atuação na Operação Lava Jato como relator e por posições garantistas em matéria penal.",
    "news": [
      {
        "title": "Alpha suspende decreto que alterava regras de licenciamento ambiental em áreas de proteção",
        "url": "https://example.com/noticias/fachin-suspende-decreto-ambiental",
        "source": "Folha de S.Paulo",
        "publishedAt": "2026-03-17T10:30:00Z"
      },
      {
        "title": "Presidente do STF defende fortalecimento das instituições democráticas em discurso na OAB",
        "url": "https://example.com/noticias/fachin-discurso-oab",
        "source": "O Globo",
        "publishedAt": "2026-03-15T14:00:00Z"
      },
      {
        "title": "Alpha vota pela inconstitucionalidade de norma que restringia acesso à defensoria pública",
        "url": "https://example.com/noticias/fachin-defensoria-publica",
        "source": "Conjur",
        "publishedAt": "2026-03-12T09:15:00Z"
      },
      {
        "title": "STF sob presidência de Alpha retoma julgamentos de grande repercussão em março",
        "url": "https://example.com/noticias/stf-fachin-marco",
        "source": "Valor Econômico",
        "publishedAt": "2026-03-10T08:00:00Z"
      },
      {
        "title": "Alpha concede liminar suspendendo lei estadual que proibia linguagem neutra em escolas",
        "url": "https://example.com/noticias/fachin-linguagem-neutra",
        "source": "G1",
        "publishedAt": "2026-03-08T16:45:00Z"
      }
    ],
    "decisions": [
      {
        "case": "ADI 7432",
        "type": "Ação Direta de Inconstitucionalidade",
        "outcome": "Procedente",
        "date": "2026-03-14",
        "sourceUrl": "https://example.com/stf/adi-7432",
        "summary": "Declarou inconstitucional dispositivo de lei estadual que vedava o ensino de história e cultura afro-brasileira em escolas particulares, por violação ao art. 242 da CF."
      },
      {
        "case": "HC 198765",
        "type": "Habeas Corpus",
        "outcome": "Deferido",
        "date": "2026-03-10",
        "sourceUrl": "https://example.com/stf/hc-198765",
        "summary": "Concedeu ordem para trancar ação penal por ausência de justa causa, reconhecendo ilicitude de provas obtidas sem autorização judicial prévia."
      },
      {
        "case": "RE 1054110",
        "type": "Recurso Extraordinário",
        "outcome": "Provido",
        "date": "2026-03-05",
        "sourceUrl": "https://example.com/stf/re-1054110",
        "summary": "Reconheceu repercussão geral e proveu recurso para assegurar direito de servidores públicos à revisão de benefício previdenciário com base em legislação mais favorável."
      },
      {
        "case": "MS 38901",
        "type": "Mandado de Segurança",
        "outcome": "Indeferido",
        "date": "2026-02-28",
        "sourceUrl": "https://example.com/stf/ms-38901",
        "summary": "Indeferiu mandado de segurança impetrado por partido político contra ato do TSE que cassou registro de candidatura por irregularidades na prestação de contas."
      },
      {
        "case": "ADPF 812",
        "type": "Arguição de Descumprimento de Preceito Fundamental",
        "outcome": "Parcialmente Procedente",
        "date": "2026-02-20",
        "sourceUrl": "https://example.com/stf/adpf-812",
        "summary": "Julgou parcialmente procedente arguição para declarar estado de coisas inconstitucional no sistema prisional de três estados, determinando elaboração de plano de ação."
      }
    ]
  },
  {
    "id": "ministro-beta",
    "name": "Ministro Beta",
    "role": "Ministro do STF",
    "position": "Vice-Presidente",
    "appointedBy": "Presidente Quinário",
    "appointedAt": "2017-02-22",
    "birthYear": 1968,
    "birthState": "São Paulo",
    "education": "Universidade Pública H",
    "photoUrl": "https://placehold.co/300x400/1a3a5c/ffffff?text=Beta",
    "bio": "Ministro Beta é natural de São Paulo (SP). Foi Secretário de Segurança Pública do Estado de São Paulo e Ministro da Justiça antes de ser indicado ao STF. É doutor em Direito do Estado pela Univ H e autor de obras de referência em Direito Constitucional.",
    "news": [
      {
        "title": "Beta determina desbloqueio de contas de empresa investigada após pagamento de fiança",
        "url": "https://example.com/noticias/moraes-desbloqueio-contas",
        "source": "Estadão",
        "publishedAt": "2026-03-16T11:00:00Z"
      },
      {
        "title": "Vice-presidente do STF profere voto divergente em caso sobre imunidade parlamentar",
        "url": "https://example.com/noticias/moraes-imunidade-parlamentar",
        "source": "Conjur",
        "publishedAt": "2026-03-13T15:30:00Z"
      },
      {
        "title": "Beta nega pedido de habeas corpus a réu condenado por crimes eleitorais",
        "url": "https://example.com/noticias/moraes-nega-hc-eleitoral",
        "source": "UOL",
        "publishedAt": "2026-03-11T09:00:00Z"
      },
      {
        "title": "Ministro mantém prisão preventiva de investigado em inquérito de desinformação",
        "url": "https://example.com/noticias/moraes-prisao-preventiva",
        "source": "Folha de S.Paulo",
        "publishedAt": "2026-03-07T17:20:00Z"
      },
      {
        "title": "Ministro Beta participa de conferência internacional sobre democracia digital",
        "url": "https://example.com/noticias/moraes-conferencia-democracia",
        "source": "O Globo",
        "publishedAt": "2026-03-04T10:00:00Z"
      }
    ],
    "decisions": [
      {
        "case": "INQ 4781",
        "type": "Inquérito",
        "outcome": "Recebida denúncia",
        "date": "2026-03-12",
        "sourceUrl": "https://example.com/stf/inq-4781",
        "summary": "Recebeu denúncia do Ministério Público Federal contra investigados por suposta organização criminosa voltada à disseminação de notícias falsas e ataques às instituições democráticas."
      },
      {
        "case": "HC 201234",
        "type": "Habeas Corpus",
        "outcome": "Indeferido",
        "date": "2026-03-08",
        "sourceUrl": "https://example.com/stf/hc-201234",
        "summary": "Indeferiu pedido de habeas corpus, mantendo prisão preventiva de investigado por entender presentes os requisitos legais para a custódia cautelar."
      },
      {
        "case": "ADI 6387",
        "type": "Ação Direta de Inconstitucionalidade",
        "outcome": "Medida Cautelar Deferida",
        "date": "2026-02-25",
        "sourceUrl": "https://example.com/stf/adi-6387",
        "summary": "Deferiu medida cautelar para suspender dispositivos de resolução do TSE que alteravam regras de propaganda eleitoral em redes sociais, até julgamento definitivo."
      },
      {
        "case": "RCL 54321",
        "type": "Reclamação",
        "outcome": "Procedente",
        "date": "2026-02-18",
        "sourceUrl": "https://example.com/stf/rcl-54321",
        "summary": "Julgou procedente reclamação para cassar decisão de tribunal inferior que havia descumprido entendimento firmado pelo STF em sede de repercussão geral."
      },
      {
        "case": "Pet 9876",
        "type": "Petição",
        "outcome": "Deferida",
        "date": "2026-02-10",
        "sourceUrl": "https://example.com/stf/pet-9876",
        "summary": "Deferiu pedido de diligências para oitiva de testemunhas no âmbito de inquérito que apura crimes contra o Estado Democrático de Direito."
      }
    ]
  },
  {
    "id": "ministro-gamma",
    "name": "Ministro Gamma",
    "role": "Ministro do STF",
    "position": "Decano",
    "appointedBy": "Presidente Secundário",
    "appointedAt": "2002-06-20",
    "birthYear": 1955,
    "birthState": "Mato Grosso",
    "education": "Universidade Pública F e Universidade Estrangeira G",
    "photoUrl": "https://placehold.co/300x400/1a3a5c/ffffff?text=Gamma",
    "bio": "Ministro Gamma é natural de Diamantino (MT). É doutor em Direito pela Universidade de Münster, na Alemanha, e um dos maiores especialistas brasileiros em Direito Constitucional. Foi Advogado-Geral da União e presidente do STF por dois mandatos (2008–2010).",
    "news": [
      {
        "title": "Ministro Gamma critica proposta de emenda constitucional que limita poderes do STF",
        "url": "https://example.com/noticias/gilmar-critica-pec",
        "source": "Valor Econômico",
        "publishedAt": "2026-03-17T08:30:00Z"
      },
      {
        "title": "Decano do STF defende revisão da jurisprudência sobre prisão em segunda instância",
        "url": "https://example.com/noticias/gilmar-segunda-instancia",
        "source": "Conjur",
        "publishedAt": "2026-03-14T13:00:00Z"
      },
      {
        "title": "Ministro Gamma concede liminar em caso de extradição controverso",
        "url": "https://example.com/noticias/gilmar-extradicao",
        "source": "Folha de S.Paulo",
        "publishedAt": "2026-03-11T10:45:00Z"
      },
      {
        "title": "Ministro mais antigo do STF completa 24 anos na corte e faz balanço de carreira",
        "url": "https://example.com/noticias/gilmar-24-anos-stf",
        "source": "O Globo",
        "publishedAt": "2026-03-06T09:00:00Z"
      },
      {
        "title": "Gamma vota contra modulação de efeitos em julgamento tributário bilionário",
        "url": "https://example.com/noticias/gilmar-modulacao-tributario",
        "source": "Estadão",
        "publishedAt": "2026-03-02T16:00:00Z"
      }
    ],
    "decisions": [